"DESCRIPTION","DURATION IN MS","NAME","PARENT SUITE","START TIME","STATUS","STOP TIME","SUB SUITE","SUITE","TEST CLASS","TEST METHOD"
"UserDetails should be able shown","1097","Verifyif the UserDetails API response is shown correctly","Phoenix API test Suite","Sun Mar 29 23:53:53 UTC 2026","passed","Sun Mar 29 23:53:54 UTC 2026","com.api.tests.UserDetailsAPITest","Inwarranty Flow Test","com.api.tests.UserDetailsAPITest","userDetailsAPITest"
"Master API should bring OEM details,Problem type,Warranty Status","691","Verify if master api is correct response","Phoenix API test Suite","Sun Mar 29 23:53:55 UTC 2026","passed","Sun Mar 29 23:53:56 UTC 2026","com.api.tests.MasterAPITest","Inwarranty Flow Test","com.api.tests.MasterAPITest","MasterAPITest"
"Correct status code is shown for invalid token","481","Verify if master api is correct status code for invalid token","Phoenix API test Suite","Sun Mar 29 23:53:56 UTC 2026","passed","Sun Mar 29 23:53:56 UTC 2026","com.api.tests.MasterAPITest","Inwarranty Flow Test","com.api.tests.MasterAPITest","invalidTokenMasterAPITest"
"Verify if FD user is able to login via api","3628","Verifying if login api is working for FD user","Phoenix API test Suite","Sun Mar 29 23:53:49 UTC 2026","passed","Sun Mar 29 23:53:53 UTC 2026","com.api.tests.LoginAPITest","Inwarranty Flow Test","com.api.tests.LoginAPITest","loginAPITest"
"Status code for invalid token is shown correctly","597","Verify if count api is correct status code for invalid token","Phoenix API test Suite","Sun Mar 29 23:53:54 UTC 2026","passed","Sun Mar 29 23:53:55 UTC 2026","com.api.tests.CountAPITest","Inwarranty Flow Test","com.api.tests.CountAPITest","countAPITest_MissingAuthToken"
"Job Count Data is shown correctly","601","Verify if count api is correct response","Phoenix API test Suite","Sun Mar 29 23:53:55 UTC 2026","passed","Sun Mar 29 23:53:55 UTC 2026","com.api.tests.CountAPITest","Inwarranty Flow Test","com.api.tests.CountAPITest","verifyCountAPIResponse"
"FD should be able to create Job","572","Verify if create job api is able to create Inwarranty job","Phoenix API test Suite","Sun Mar 29 23:53:56 UTC 2026","failed","Sun Mar 29 23:53:57 UTC 2026","com.api.tests.CreateJobAPITest","Inwarranty Flow Test","com.api.tests.CreateJobAPITest","CreateJobAPITest"
"Job Details is shown correctly for FD","1538","Verify if details api is correct response","Phoenix API test Suite","Sun Mar 29 23:53:57 UTC 2026","passed","Sun Mar 29 23:53:58 UTC 2026","com.api.tests.DetailsAPITest","Inwarranty Flow Test","com.api.tests.DetailsAPITest","verifyDetailAPIResponse"
"FD should be able to search Job","519","Verify if search api is correct response","Phoenix API test Suite","Sun Mar 29 23:53:58 UTC 2026","passed","Sun Mar 29 23:53:59 UTC 2026","com.api.tests.SearchAPITest","Inwarranty Flow Test","com.api.tests.SearchAPITest","verifySearchAPIResponse"
